{
  "schemaVersion": "1.0.0",
  "previewLedgerId": "FARDARTER-DRIVE-CANONICALIZATION-PREVIEWS-V6-4",
  "driveId": "FARDARTER-DRIVE-V6",
  "controllerVersion": "6.4.0",
  "controllingIssue": 165,
  "canonicalHead": {
    "sequence": 0,
    "digest": "4c401dd352d4263786ac22072d616f67775761656a771ea8815e4623a7a3975b",
    "canonicalBusinessEventCount": 0
  },
  "proposalLedgerDigest": "3c85fe2fc195d5a0c9de45b679f9ef3a5589f36f948ea4a8acc0720483a6dc9e",
  "reconciliationDigest": "4035cd406a5db019c4f3b9122e0021b2fb3fcbb23e7e10b040333fdedeb41a22",
  "lifecycle": [
    "PREPARED",
    "PREVIEW_READY",
    "BLOCKED",
    "EXPIRED",
    "REJECTED",
    "APPLIED_BY_REVIEWED_MERGE"
  ],
  "previewCount": 1,
  "decisionCounts": {
    "PREPARED": 1,
    "PREVIEW_READY": 0,
    "BLOCKED": 0,
    "EXPIRED": 0,
    "REJECTED": 0,
    "APPLIED_BY_REVIEWED_MERGE": 0
  },
  "bundles": [
    {
      "bundleId": "FARDARTER-CANONICALIZATION-BUNDLE-ISSUE-162-V6-4",
      "path": "receipts/revenue/FARDARTER-DRIVE-CANONICALIZATION-REVIEW-BUNDLE-V6-4.sample.json",
      "bundleDigest": "3198341aebdf82e95d8cd0de680a16553cf9c3b3c2e4fd4824d197de79aa6ef2",
      "state": "PREPARED",
      "canonical": false,
      "applied": false
    }
  ],
  "applicationPolicy": {
    "automaticCanonicalization": false,
    "reviewedMergeRequired": true,
    "recomputeDigestsAtMerge": true,
    "reconcileCountsCapacityMoney": true,
    "immutableReadbackRequired": true
  },
  "evidenceBoundary": {
    "previewIsCanonicalEvent": false,
    "previewCreatesOrder": false,
    "previewCreatesContract": false,
    "previewProvesPayment": false,
    "previewStartsPaidWork": false,
    "receivedCashRequires": "PAID_SETTLED"
  },
  "googleDriveContinuity": {
    "state": "CONNECTED_PRIVATE",
    "documentTitles": [
      "Fardarter Drive™ v6.4 — Canonicalization Preview and Review Charter",
      "Fardarter Drive™ v6.4 — Canonicalization Review Bundle Register"
    ],
    "publicReferencesExposed": false
  },
  "nextControlledAction": "Validate the Issue #162 review bundle, return PREVIEW_READY without applying it, suppress duplicate approvals, and preserve the genesis-only canonical chain until a separately reviewed merge.",
  "ledgerDigest": "9294df7c63b535b292f163bc1bbc183883d05f7bd99329ed845db9d62e2e7a8c"
}
